{
    "__author": "Briar Young",
    "version": 3,
    "type": 1,
    "name": "briaryoung_pigtails",
    "img_sit": "briaryoung_pigtails",
    "pose_map": {
        "mpm_type": 0,
        "default": true,
        "use_reg_for_l": true
    },
    "stay_on_start": true,
    "ex_props": {
        "ribbon": true,
        "twintails": true
    },
    "select_info": {
        "display_name": "Pigtails",
        "thumb": "briaryoung_pigtails",
        "group": "hair"
    },
    "unlock": true
}
