{
    "__author": "Briar Young",
    "version": 3,
    "type": 1,
    "name": "briaryoung_hair_down_with_bun",
    "img_sit": "briaryoung_hair_down_with_bun",
    "pose_map": {
        "mpm_type": 0,
        "default": true,
        "use_reg_for_l": true
    },
    "stay_on_start": true,
    "select_info": {
        "display_name": "Hair Down (Bun)",
        "thumb": "briaryoung_hair_down_with_bun",
        "group": "hair"
    },
    "unlock": true
}
